{
  "part_id": "mfg-004",
  "unit": "件",
  "std_cost_twd": 310,
  "safety_stock": 50,
  "reorder_qty": 150,
  "lead_time_days": 10,
  "make_or_buy": "自製（陽極處理委外）",
  "stock": [
    {
      "warehouse_id": "WH-A",
      "bin": "A-04-3",
      "lot_no": "L2609-04",
      "status": "可用",
      "qty": 132,
      "received_on": "2026-09-13",
      "note": null
    },
    {
      "warehouse_id": "WH-B",
      "bin": "B-02-1",
      "lot_no": "L2607-11",
      "status": "保留",
      "qty": 60,
      "received_on": "2026-09-16",
      "note": "保留給 SO-2609-015（沛宇機電）"
    },
    {
      "warehouse_id": "WH-B",
      "bin": "B-02-1",
      "lot_no": "L2607-11",
      "status": "可用",
      "qty": 26,
      "received_on": "2026-09-16",
      "note": null
    },
    {
      "warehouse_id": "WH-B",
      "bin": "B-02-2",
      "lot_no": "L2609-04",
      "status": "可用",
      "qty": 19,
      "received_on": "2026-09-16",
      "note": null
    }
  ],
  "moves": [
    {
      "moved_on": "2026-08-01",
      "warehouse_id": "WH-A",
      "move_type": "期初",
      "qty": 146,
      "ref_no": "OB-2608",
      "note": "八月期初庫存"
    },
    {
      "moved_on": "2026-09-12",
      "warehouse_id": "WH-Q",
      "move_type": "生產入庫",
      "qty": 150,
      "ref_no": "WO-2609-04",
      "note": "完工入庫，待品檢"
    },
    {
      "moved_on": "2026-09-13",
      "warehouse_id": "WH-Q",
      "move_type": "調撥出",
      "qty": -150,
      "ref_no": "WO-2609-04",
      "note": "檢驗合格"
    },
    {
      "moved_on": "2026-09-13",
      "warehouse_id": "WH-A",
      "move_type": "調撥入",
      "qty": 150,
      "ref_no": "WO-2609-04",
      "note": "檢驗合格入庫"
    },
    {
      "moved_on": "2026-09-16",
      "warehouse_id": "WH-A",
      "move_type": "調撥出",
      "qty": -165,
      "ref_no": "TR-2609-07",
      "note": "二廠出貨備料"
    },
    {
      "moved_on": "2026-09-16",
      "warehouse_id": "WH-B",
      "move_type": "調撥入",
      "qty": 165,
      "ref_no": "TR-2609-07",
      "note": "二廠出貨備料"
    },
    {
      "moved_on": "2026-09-24",
      "warehouse_id": "WH-B",
      "move_type": "銷貨出庫",
      "qty": -60,
      "ref_no": "SO-2609-015",
      "note": null
    },
    {
      "moved_on": "2026-09-30",
      "warehouse_id": "WH-A",
      "move_type": "盤點調整",
      "qty": 1,
      "ref_no": "IC-2609",
      "note": "九月月底盤點：實盤多 1 件"
    }
  ],
  "work_orders": [
    {
      "wo_no": "WO-2609-04",
      "qty_planned": 150,
      "qty_done": 150,
      "status": "已完工",
      "line": "VMC-02",
      "start_on": "2026-09-01",
      "due_on": "2026-09-12",
      "note": null
    },
    {
      "wo_no": "WO-2610-01",
      "qty_planned": 150,
      "qty_done": 0,
      "status": "已開立",
      "line": "VMC-02",
      "start_on": "2026-10-05",
      "due_on": "2026-10-16",
      "note": null
    }
  ],
  "sales_orders": [
    {
      "so_no": "SO-2609-015",
      "line_no": 1,
      "customer": "沛宇機電",
      "qty": 120,
      "qty_shipped": 60,
      "order_on": "2026-09-18",
      "due_on": "2026-10-02",
      "status": "部分出貨"
    },
    {
      "so_no": "SO-2609-027",
      "line_no": 1,
      "customer": "沛宇機電",
      "qty": 80,
      "qty_shipped": 0,
      "order_on": "2026-09-29",
      "due_on": "2026-10-23",
      "status": "待出貨"
    }
  ]
}
